{
  "name": "monish",
  "owner": {
    "github": "Monish25"
  },
  "claimedAt": "2026-09-17T14:52:19.141Z",
  "records": {
    "CNAME": "cname.vercel-dns.com"
  },
  "country": "IN",
  "subdomains": {
    "_vercel": {
      "TXT": [
        "vc-domain-verify=runs-on.dev,472ae9b2bc9fdfa6a913"
      ]
    },
    "monish": {
      "CNAME": "62cbe4e8b6c79f10.vercel-dns-017.com"
    }
  }
}
