{
  "name": "loop",
  "owner": {
    "github": "MacTash"
  },
  "claimedAt": "2026-09-03T04:30:54.532Z",
  "records": {
    "CNAME": "a283ed7d15134c2b.vercel-dns-017.com"
  },
  "subdomains": {
    "_vercel": {
      "TXT": [
        "vc-domain-verify=loop.runs-on.dev,265655a973a4899013d4"
      ]
    }
  }
}
