{
  "name": "sammdo",
  "owner": {
    "github": "SammdoDev"
  },
  "claimedAt": "2026-09-08T12:56:55.989Z",
  "records": {
    "CNAME": "dvlps-portfolio.vercel.app"
  },
  "profile": {
    "name": "SammdoDev",
    "links": [
      {
        "label": "My Portfolio",
        "url": "https://dvlps-portfolio.vercel.app"
      }
    ]
  }
}
