{
  "name": "aupro",
  "owner": {
    "github": "naruzuma56"
  },
  "claimedAt": "2026-09-19T01:13:46.646Z",
  "records": {
    "CNAME": "zingy-basbousa-c823ff.netlify.app"
  },
  "country": "IN",
  "subdomains": {
    "subdomain-owner-verification": {
      "TXT": [
        "a9b1aec6f7a31f9b01091a3d4d732546"
      ]
    }
  }
}
