{
  "name": "anmol-gola",
  "owner": {
    "github": "ANMOLGOLA"
  },
  "claimedAt": "2026-09-03T18:07:59.073Z",
  "records": {
    "CNAME": "c2514d4d9412e88c.vercel-dns-017.com"
  },
  "subdomains": {
    "_vercel": {
      "TXT": [
        "vc-domain-verify=anmol-gola.runs-on.dev,817ac68b62d9200929a3"
      ]
    }
  }
}
