{
  "name": "mcpgram",
  "owner": {
    "github": "Aryan418-dev"
  },
  "claimedAt": "2026-09-17T03:41:16.689Z",
  "records": {
    "URL": "https://mcpgram.vercel.app/"
  },
  "country": "IN",
  "profile": {
    "name": "Aryan418-dev",
    "links": [
      {
        "label": "Aryan",
        "url": "https://github.com/Aryan418-dev"
      }
    ]
  },
  "subdomains": {
    "_vercel": {
      "TXT": [
        "vc-domain-verify=runs-on.dev,ce38ee4b23fff7628e22"
      ]
    }
  }
}
