{
  "name": "inward",
  "owner": {
    "github": "chinmay29hub"
  },
  "claimedAt": "2026-09-19T09:27:53.435Z",
  "records": {
    "CNAME": "cname.vercel-dns.com"
  },
  "country": "IN",
  "subdomains": {
    "_vercel": {
      "TXT": [
        "vc-domain-verify=inward.runs-on.dev,1719c7169056dc3c46c9"
      ]
    }
  }
}
