{
  "name": "darshan-karthikeya",
  "owner": {
    "github": "karthikeya1220"
  },
  "claimedAt": "2026-09-19T06:54:23.030Z",
  "records": {
    "CNAME": "5ce7165f011a499d.vercel-dns-017.com"
  },
  "country": "IN",
  "profile": {
    "name": "karthikeya1220"
  },
  "subdomains": {
    "_vercel": {
      "TXT": [
        "vc-domain-verify=darshan-karthikeya.runs-on.dev,a9603b50c45e906cf060"
      ]
    }
  }
}
