{
  "name": "speakupai",
  "owner": {
    "github": "mvvarmora"
  },
  "claimedAt": "2026-09-20T16:17:07.741Z",
  "records": {
    "CNAME": "f38c926bb452ed5f.vercel-dns-017.com"
  },
  "profile": {
    "name": "mvvarmora",
    "bio": "tech driven profile  , innovator"
  },
  "country": "IN",
  "subdomains": {
    "speakupai": {
      "TXT": [
        "vc-domain-verify=speakupai.runs-on.dev,bed1d632d03cb87bf37d"
      ]
    }
  }
}
