{
  "name": "ujval",
  "owner": {
    "github": "ujvall"
  },
  "claimedAt": "2026-09-20T08:05:26.209Z",
  "records": {
    "CNAME": "76841296cf871729.vercel-dns-017.com"
  },
  "country": "IN",
  "subdomains": {
    "_vercel": {
      "TXT": [
        "vc-domain-verify=ujval.runs-on.dev,07585f0c4cf056ba4124"
      ]
    }
  }
}
