{
  "name": "presentation",
  "owner": {
    "github": "ackerlex"
  },
  "claimedAt": "2026-09-21T19:10:47.167Z",
  "records": {
    "CNAME": "cname.vercel-dns.com"
  },
  "subdomains": {
    "orien": {
      "CNAME": "df6f2136671ce258.vercel-dns-017.com"
    }
  },
  "profile": {
    "name": "English"
  },
  "country": "MA"
}
