{
  "name": "berry-astra",
  "owner": {
    "github": "hoshimiMiyabi-dev"
  },
  "claimedAt": "2026-09-03T04:51:19.549Z",
  "records": {
    "CNAME": "cname.vercel-dns.com"
  },
  "subdomains": {
    "_discord": {
      "TXT": [
        "dh=8d7267eb2dd4d26c6f9201d89481fd67062a7c99"
      ]
    }
  }
}
