{
  "name": "anshu",
  "owner": {
    "github": "TechWhiz0"
  },
  "claimedAt": "2026-09-19T17:02:50.487Z",
  "records": {
    "CNAME": "cname.vercel-dns.com"
  },
  "country": "IN",
  "subdomains": {
    "_vercel": {
      "TXT": [
        "vc-domain-verify=anshu.runs-on.dev,4123931aff809fef0e21"
      ]
    }
  }
}
